### ISSUE TITLE
Slow web search by device name

### ISSUE THREAD

**Issue by Ignacet** [netdisco/netdisco#808]
Hi.

I found abnormal behavior. In the latest version's of Nedisco's we got very slow search engines speed by name. If searching by IP, the search speed is normal.  In the screenshots you can see the output of the netdisco Statistics and the debug of the Explorer.

First Screenshots it's a search by name, the search took 15 seconds.
![image](https://user-images.githubusercontent.com/35425405/132254787-85840a63-f261-4a13-b7d7-694b710c8c04.png)

And by IP the search took 280mSec. 
![image](https://user-images.githubusercontent.com/35425405/132255769-bffa4a0f-d6c6-45a2-ab02-1441e864afc2.png)

In previous versions of Netdisco (2.046) the delay of the search by name and by IP were similar.
Let me know if you need, any aditional debug command.

Tks...

**Comment by rc9000** [comment]
Hi! I gave this a try, but for me it still runs the same like in the previous version I had installed (2.047005). Also whether it's an ip or a hostname prefix doesn't seem to matter much, they both finish in about a second. 

I'm putting the queries that are generated below, in case you or somebody else wants to try them directly in Postgres. Unfortunately the many parameters must be put back into the query by hand before it can be run in psql.

Interesting would be what an `explain analyze <the query>` looks like. 

Queries, first for a string and then the ip prefix 199.18.162:

    
    SELECT
      me.ip, me.creation, me.dns, me.description, me.uptime,
      me.contact, me.name, me.location, me.layers, me.num_ports,
      me.mac, me.serial, me.chassis_id, me.model, me.ps1_type,
      me.ps2_type, me.ps1_status, me.ps2_status, me.fan,
      me.slots, me.vendor, me.os, me.os_ver, me.log,
      me.snmp_ver, me.snmp_comm, me.snmp_class, me.snmp_engineid, me.vtp_domain,
      me.last_discover, me.last_macsuck, me.last_arpnip
    FROM
      device me
      LEFT JOIN device_port ports_by_mac ON (
        ports_by_mac.ip = me.ip
        AND ports_by_mac.mac :: text ILIKE $ 1
      )
      LEFT JOIN device_ip device_ips_by_address_or_name ON (
        (
          device_ips_by_address_or_name.dns ILIKE $ 2
          OR device_ips_by_address_or_name.alias < <= $ 3
          OR device_ips_by_address_or_name.alias :: text ILIKE $ 4
        )
        AND device_ips_by_address_or_name.ip = me.ip
      )
    WHERE
      (
        (
          me.contact ILIKE $ 5
          OR me.serial ILIKE $ 6
          OR me.chassis_id ILIKE $ 7
          OR me.location ILIKE $ 8
          OR me.name ILIKE $ 9
          OR me.description ILIKE $ 10
          OR me.ip IN (
            SELECT
              me.ip
            FROM
              device me
              LEFT JOIN device_module modules ON modules.ip = me.ip
            WHERE
              (modules.serial = $ 11)
          )
          OR (
            me.mac :: text ILIKE $ 12
            OR ports_by_mac.mac :: text ILIKE $ 13
          )
          OR (
            me.dns ILIKE $ 14
            OR device_ips_by_address_or_name.dns ILIKE $ 15
          )
          OR (
            me.ip :: text ILIKE $ 16
            OR device_ips_by_address_or_name.alias :: text ILIKE $ 17
          )
        )
      )
    GROUP BY
      me.ip, me.creation, me.dns, me.description, me.uptime, me.contact,
      me.name, me.location, me.layers, me.num_ports, me.mac, me.serial,
      me.chassis_id, me.model, me.ps1_type, me.ps2_type, me.ps1_status, me.ps2_status,
      me.fan, me.slots, me.vendor, me.os, me.os_ver, me.log,
      me.snmp_ver, me.snmp_comm, me.snmp_class, me.snmp_engineid, me.vtp_domain,
      me.last_discover, me.last_macsuck, me.last_arpnip
    ORDER BY
      me.dns,
      me.ip
    
    2021-09-08 00:16:00.627 CEST [32880] [netdisco] [[unknown]] DETAIL:  
    parameters: $1 = '%thesearchterm%', $2 = '%thesearchterm%', $3 = '255.255.255.255', $4 = '%thesearchterm%', $5 = '%thesearchterm%', 
    $6 = '%thesearchterm%', $7 = '%thesearchterm%', $8 = '%thesearchterm%', $9 = '%thesearchterm%', $10 = '%thesearchterm%', $11 = 'thesearchterm', 
    $12 = '%thesearchterm%', $13 = '%thesearchterm%', $14 = '%thesearchterm%', $15 = '%thesearchterm%', $16 = '%thesearchterm%', $17 = '%thesearchterm%'
    
    SELECT
      me.ip, me.creation, me.dns, me.description, me.uptime, me.contact,
      me.name, me.location, me.layers, me.num_ports, me.mac, me.serial,
      me.chassis_id, me.model, me.ps1_type, me.ps2_type, me.ps1_status, me.ps2_status,
      me.fan, me.slots, me.vendor, me.os, me.os_ver, me.log,
      me.snmp_ver, me.snmp_comm, me.snmp_class, me.snmp_engineid, me.vtp_domain,
      me.last_discover, me.last_macsuck, me.last_arpnip
    FROM
      device me
      LEFT JOIN device_port ports_by_mac ON (
        ports_by_mac.ip = me.ip
        AND ports_by_mac.mac :: text ILIKE $ 1
      )
      LEFT JOIN device_ip device_ips_by_address_or_name ON (
        (
          device_ips_by_address_or_name.dns ILIKE $ 2
          OR device_ips_by_address_or_name.alias < <= $ 3
          OR device_ips_by_address_or_name.alias :: text ILIKE $ 4
        )
        AND device_ips_by_address_or_name.ip = me.ip
      )
    WHERE
      (
        (
          me.contact ILIKE $ 5
          OR me.serial ILIKE $ 6
          OR me.chassis_id ILIKE $ 7
          OR me.location ILIKE $ 8
          OR me.name ILIKE $ 9
          OR me.description ILIKE $ 10
          OR me.ip IN (
            SELECT
              me.ip
            FROM
              device me
              LEFT JOIN device_module modules ON modules.ip = me.ip
            WHERE
              (modules.serial = $ 11)
          )
          OR (
            me.mac :: text ILIKE $ 12
            OR ports_by_mac.mac :: text ILIKE $ 13
          )
          OR (
            me.dns ILIKE $ 14
            OR device_ips_by_address_or_name.dns ILIKE $ 15
          )
          OR (
            me.ip < <= $ 16
            OR device_ips_by_address_or_name.alias < <= $ 17
          )
        )
      )
    GROUP BY
      me.ip, me.creation, me.dns, me.description, me.uptime, me.contact,
      me.name, me.location, me.layers, me.num_ports, me.mac, me.serial,
      me.chassis_id, me.model, me.ps1_type, me.ps2_type, me.ps1_status,
      me.ps2_status, me.fan, me.slots, me.vendor, me.os, me.os_ver,
      me.log, me.snmp_ver, me.snmp_comm, me.snmp_class, me.snmp_engineid,
      me.vtp_domain, me.last_discover, me.last_macsuck, me.last_arpnip
    ORDER BY
      me.dns,
      me.ip
    
    2021-09-08 00:19:59.683 CEST [32877] [netdisco] [[unknown]] DETAIL:  
    parameters: $1 = '%199.18.162%', $2 = '%199.18.162%', $3 = '199.18.0.162', $4 = '%199.18.162%', $5 = '%199.18.162%', 
    $6 = '%199.18.162%', $7 = '%199.18.162%', $8 = '%199.18.162%', $9 = '%199.18.162%', $10 = '%199.18.162%', 
    $11 = '199.18.162', $12 = '%199.18.162%', $13 = '%199.18.162%', $14 = '%199.18.162%', $15 = '%199.18.162%', $16 = '199.18.0.162', $17 = '199.18.0.162'

**Comment by ollyg** [comment]
I'm giving commits 3aeed20 and f1224b0 the side-eye

**Comment by Ignacet** [comment]
Hi, i test it. 
I reverting the commit 3aeed20 and f1224b0, and it is worse. 
The search by name, took 23 seconds.
![image](https://user-images.githubusercontent.com/35425405/132856408-c12b1ff6-f136-4ec5-8f75-53bbdae97bae.png)

And by IP the search took 7Seg.
![image](https://user-images.githubusercontent.com/35425405/132856461-2940af50-24c0-4032-ad95-a3c0cf154549.png)

Restoring commit's again the search by name took 15 Seg, and by IP took  318mSeg.

**Comment by ollyg** [comment]
Very helpful, thank you @Ignacet !
So perhaps this is SQL related.

**Comment by Ignacet** [comment]
Tks, to you, for you time.
There is a possibility to simplify the SQL QUERY for the search autocompletion combo by name terms, because is to slow with a  complex QUERY. By IP terms the autocompletation is instant.

**Comment by inphobia** [comment]
i've tested with 2.049005 but can't reproduce it. about same amount of devices & ips. half the amount of interfaces & nodes. even a typeahead that returns 650 items only takes 300msec.


perhaps relevant parts of my config.
```
nbtstat_no: "any"
node_freshness: 1500
expire_jobs: 5
expire_nodes_archive: 75
```

i have noticed in the past that due to our access pattern postgres can get bloated. my recommendations would be to clear the admin table via the web interface -> job queue -> delete button in top right.
then have a vacuum & reindex of your database tables.

we have a wiki entry about that here: https://github.com/netdisco/netdisco/wiki/Install-Tips#database-disk-usage

but if you're running the same database for a long time i'd recommend to just vacuum & reindex all the tables first.

**Comment by Ignacet** [comment]
hi, tks for you time.. the database is new to test we reinstall the netdisco (fresh start) and load all the devices again, but the delay in the searches is the same as before. I test the complete query in the POSQL database and its find.

<pre>
bash-5.1# psql -U netdisco -W
Password: 
psql (13.4)
Type "help" for help.

netdisco=>
EXPLAIN ANALYZE SELECT
  me.ip, me.creation, me.dns, me.description, me.uptime,
  me.contact, me.name, me.location, me.layers, me.num_ports,
  me.mac, me.serial, me.chassis_id, me.model, me.ps1_type,
  me.ps2_type, me.ps1_status, me.ps2_status, me.fan,
  me.slots, me.vendor, me.os, me.os_ver, me.log,
  me.snmp_ver, me.snmp_comm, me.snmp_class, me.snmp_engineid, me.vtp_domain,
  me.last_discover, me.last_macsuck, me.last_arpnip
FROM
  device me
  LEFT JOIN device_port ports_by_mac ON (
    ports_by_mac.ip = me.ip
    AND ports_by_mac.mac :: text ILIKE '%CCTV%'
  )
  LEFT JOIN device_ip device_ips_by_address_or_name ON (
    (
      device_ips_by_address_or_name.dns ILIKE '%CCTV%'
      OR device_ips_by_address_or_name.alias <= '255.255.255.255'
      OR device_ips_by_address_or_name.alias :: text ILIKE '%CCTV%'
    )
    AND device_ips_by_address_or_name.ip = me.ip
  )
WHERE
  (
    (
      me.contact ILIKE '%CCTV%'
      OR me.serial ILIKE '%CCTV%'
      OR me.chassis_id ILIKE '%CCTV%'
      OR me.location ILIKE '%CCTV%'
      OR me.name ILIKE '%CCTV%'
      OR me.description ILIKE '%CCTV%'
      OR me.ip IN (
        SELECT
          me.ip
        FROM
          device me
          LEFT JOIN device_module modules ON modules.ip = me.ip
        WHERE
          (modules.serial = '%CCTV%')
      )
      OR (
        me.mac :: text ILIKE '%CCTV%'
        OR ports_by_mac.mac :: text ILIKE '%CCTV%'
      )
      OR (
        me.dns ILIKE '%CCTV%'
        OR device_ips_by_address_or_name.dns ILIKE '%CCTV%'
      )
      OR (
        me.ip :: text ILIKE '%CCTV%'
        OR device_ips_by_address_or_name.alias :: text ILIKE '%CCTV%'
      )
    )
  )
GROUP BY
  me.ip, me.creation, me.dns, me.description, me.uptime, me.contact,
  me.name, me.location, me.layers, me.num_ports, me.mac, me.serial,
  me.chassis_id, me.model, me.ps1_type, me.ps2_type, me.ps1_status, me.ps2_status,
  me.fan, me.slots, me.vendor, me.os, me.os_ver, me.log,
  me.snmp_ver, me.snmp_comm, me.snmp_class, me.snmp_engineid, me.vtp_domain,
  me.last_discover, me.last_macsuck, me.last_arpnip
ORDER BY
  me.dns,
  me.ip;
</pre>

And the result of the analize:
<pre>
                                                                                                                                                                                                                                                                         QUERY PLAN                                                                                                                                                                                                                                                                          
-------------------------------------------------------------------------------------------------------------------------------------------------------------------------------------------------------------------------------------------------------------------------------------------------------------------------------------------------------------------------------------------------------------------------------------------------------------------------------------------------------------------------------------------------------------
 Sort  (cost=7595.81..7598.29 rows=991 width=622) (actual time=362.072..362.109 rows=11 loops=1)
   Sort Key: me.dns, me.ip
   Sort Method: quicksort  Memory: 35kB
   ->  HashAggregate  (cost=7536.59..7546.50 rows=991 width=622) (actual time=361.911..361.972 rows=11 loops=1)
         Group Key: me.ip
         Batches: 1  Memory Usage: 81kB
         ->  Hash Right Join  (cost=2827.71..7530.12 rows=2589 width=622) (actual time=214.397..361.773 rows=30 loops=1)
               Hash Cond: (ports_by_mac.ip = me.ip)
               Filter: ((me.contact ~~* '%CCTV%'::text) OR (me.serial ~~* '%CCTV%'::text) OR (me.chassis_id ~~* '%CCTV%'::text) OR (me.location ~~* '%CCTV%'::text) OR (me.name ~~* '%CCTV%'::text) OR (me.description ~~* '%CCTV%'::text) OR (hashed SubPlan 1) OR ((me.mac)::text ~~* '%CCTV%'::text) OR ((ports_by_mac.mac)::text ~~* '%CCTV%'::text) OR (me.dns ~~* '%CCTV%'::text) OR (device_ips_by_address_or_name.dns ~~* '%CCTV%'::text) OR ((me.ip)::text ~~* '%CCTV%'::text) OR ((device_ips_by_address_or_name.alias)::text ~~* '%CCTV%'::text))
               Rows Removed by Filter: 4959
               ->  Seq Scan on device_port ports_by_mac  (cost=0.00..4575.64 rows=425 width=13) (actual time=138.142..138.143 rows=0 loops=1)
                     Filter: ((mac)::text ~~* '%CCTV%'::text)
                     Rows Removed by Filter: 53065
               ->  Hash  (cost=286.23..286.23 rows=4989 width=649) (actual time=49.045..49.057 rows=4989 loops=1)
                     Buckets: 8192  Batches: 1  Memory Usage: 2991kB
                     ->  Hash Right Join  (cost=108.30..286.23 rows=4989 width=649) (actual time=6.336..28.849 rows=4989 loops=1)
                           Hash Cond: (device_ips_by_address_or_name.ip = me.ip)
                           ->  Seq Scan on device_ip device_ips_by_address_or_name  (cost=0.00..164.78 rows=4989 width=34) (actual time=0.016..7.310 rows=4989 loops=1)
                                 Filter: ((dns ~~* '%CCTV%'::text) OR (alias <= '255.255.255.255'::inet) OR ((alias)::text ~~* '%CCTV%'::text))
                           ->  Hash  (cost=95.91..95.91 rows=991 width=622) (actual time=6.264..6.269 rows=991 loops=1)
                                 Buckets: 1024  Batches: 1  Memory Usage: 574kB
                                 ->  Seq Scan on device me  (cost=0.00..95.91 rows=991 width=622) (actual time=0.027..2.249 rows=991 loops=1)
               SubPlan 1
                 ->  Nested Loop  (cost=0.28..2479.11 rows=2 width=7) (actual time=23.639..23.643 rows=0 loops=1)
                       ->  Seq Scan on device_module modules  (cost=0.00..2462.51 rows=2 width=7) (actual time=23.636..23.637 rows=0 loops=1)
                             Filter: (serial = '%CCTV%'::text)
                             Rows Removed by Filter: 64681
                       ->  Index Only Scan using device_pkey on device me_1  (cost=0.28..8.29 rows=1 width=7) (never executed)
                             Index Cond: (ip = modules.ip)
                             Heap Fetches: 0
 Planning Time: 8.601 ms
 Execution Time: 364.552 ms
</pre>

I dont now but in the Web this query took 15 Seconds to show results, and in the database 364mseg. :-(

![image](https://user-images.githubusercontent.com/35425405/132990743-46d0f71e-57f3-48c0-a404-b424eab2ba67.png)

** Can you think of any other test I can take? **

**Comment by ollyg** [comment]
Hi @Ignacet, if it is possible, you can try:
1. add "`no_auth: true`" to your `deployment.yml`
2. restart netdisco-web
3. `curl -H 'X-Requested-With: XMLHttpRequest' 'http://localhost:5000/ajax/data/devicename/typeahead?query=PARTIAL'`

Change PARTIAL to the search term. See how long that takes and if it returns correct results?

The idea here is to first eliminate the javascript in the web doing the typeahead.

**Comment by Ignacet** [comment]
Yes is posible:

<pre>
root@centreon:~# time curl -H 'X-Requested-With: XMLHttpRequest' 'http://10.248.93.15:5000/ntd_TASA/ajax/data/devicename/typeahead?query=CCTV'
["RCC-CCTV-xxxxxxx","RT-CPF-TIC_CCTVxxxxxxxxxxxx","RT-CPF-CCTV-xxxxxxxxxxxxx","SW-CPF-CCTV-xxxxxxxxxxxxx"]
real    0m15.373s
user    0m0.000s
sys     0m0.004s
root@centreon:~#
</pre>

**real    0m15.373s**

the same delay

**Comment by ollyg** [comment]
excellent, thank you @Ignacet that's good progress, we can eliminate a few things and move on

**Comment by ollyg** [comment]
Hi @Ignacet, another test now, and I'm not sure how possible this will be for you:

````
NETDISCO_DB_USER=CHANGEME NETDISCO_DB_NAME=CHANGEME \
NETDISCO_DB_HOST=CHANGEME NETDISCO_DB_PASS=CHANGEME \
  DBIC_TRACE=1 time perl -Ilib -MApp::Netdisco -MDancer::Plugin::DBIC=schema \
  -e '@x = schema("netdisco")->resultset("Device")->search_fuzzy("CCTV")'
````

Change the CHANGEMEx4 for the settings needed. This should also exhibit the same slowness. Can you share the output?

**Comment by Ignacet** [comment]
I need some instructions on how to run those lines, :-)
This lines run in the postqress SQL comnad line? or in the PERL file?

**Comment by ollyg** [comment]
Sorry, @Ignacet that's for the command line, as the Netdisco user. It may not work though, as my environment is different to yours.

**Comment by ollyg** [comment]
Oh, also, it is one long command to be entered as one line, I just split it there to make it easier to read. Don't copy that back to us here, as it will include your password!

**Comment by Ignacet** [comment]
Now i use the docker image, this is the output:

<pre>
~ $ NETDISCO_DB_USER=netdisco NETDISCO_DB_NAME=netdisco \
> NETDISCO_DB_HOST=localhost NETDISCO_DB_PASS=netdisco \
>   DBIC_TRACE=1 time ~netdisco/bin/localenv perl -MApp::Netdisco -MDancer::Plugin::DBIC=schema \
>   -e '@x = schema("netdisco")->resultset("Device")->search_fuzzy("CCTV")'
Can't locate AnyEvent/Socket.pm:   /root/nd-site-local/lib/AnyEvent/Socket.pm: Permission denied at /home/netdisco/perl5/lib/perl5/App/Netdisco/Configuration.pm line 114.
BEGIN failed--compilation aborted at /home/netdisco/perl5/lib/perl5/App/Netdisco/Configuration.pm line 114.
Compilation failed in require at /home/netdisco/perl5/lib/perl5/App/Netdisco.pm line 8.
BEGIN failed--compilation aborted at /home/netdisco/perl5/lib/perl5/App/Netdisco.pm line 8.
Compilation failed in require.
BEGIN failed--compilation aborted.
Command exited with non-zero status 13
real    0m 0.68s
user    0m 0.57s
sys     0m 0.10s
</pre>

**Comment by ollyg** [comment]
Ah, thanks! I will try to get a working command for Docker (didn't realise that is the environment you're using)

**Comment by Ignacet** [comment]
@ollyg, try this if you can, clean install in doker:

curl -Ls -o docker-compose.yml https://tinyurl.com/nd2-dockercompose
docker-compose up &

add only 2 devices.

Delay with Name **15 Seconds**
<pre>
root@jnk-ansible:/home# time curl -H 'X-Requested-With: XMLHttpRequest' 'http://localhost:8080/ajax/data/devicename/typeahead?query=S44'
["XXXXS44","XXXXS44B"]
real    0m15.085s
user    0m0.013s
sys     0m0.004s
</pre>

delay with IP, normal
<pre>
root@jnk-ansible:/home# time curl -H 'X-Requested-With: XMLHttpRequest' 'http://localhost:8080/ajax/data/devicename/typeahead?query=10.167.'
["XXXXS44","XXXXS44B"]
real    0m0.058s
user    0m0.000s
sys     0m0.011s
root@jnk-ansible:/home#
</pre>

**Comment by ollyg** [comment]
Hi @Ignacet thank you! I was not able to reproduce this :-(

So I wonder if there is something special about your two devices in the database which I have not seen in the two devices I have locally, here. Are you able to share a copy of your database with just the two devices, with me?

Also as an example, we can try this test against Netdisco public demo:
````
time curl -s -H 'X-Requested-With: XMLHttpRequest' 'https://netdisco2-demo.herokuapp.com/ajax/data/devicename/typeahead?query=leaf'
````

**Comment by ollyg** [comment]
@Ignacet my email is oliver at cpan dot org

**Comment by Ignacet** [comment]
There is no problem in sharing the database only with you.
I sent you an email with the DB. Thanks for your time.

**Comment by Ignacet** [comment]
@ollyg, I found the problem with a Tcpdump, when a word is written in the WebSearch, netdisco tries to several times resolve the name by DNS. The written name does not exist in the DNS and until it gives timeout it does not continue with the search for about 15 seconds.

When I write in theWeb search "art", this is the TCPdump
<pre>
16:40:45.112472 IP netdisco.52706 > X.X.X.X.domain: 2338+ A? art. (21)
16:40:45.115170 IP X.X.X.X.domain > netdisco.52706: 2338 ServFail 0/0/0 (21)
16:40:45.118257 IP netdisco.57232 > X.X.X.X.domain: 2338+ A? art. (21)
16:40:45.120741 IP X.X.X.X.domain > netdisco.57232: 2338 ServFail 0/0/0 (21)
16:40:45.123905 IP netdisco.41046 > X.X.X.X.domain: 2338+ A? art. (21)
16:40:45.126357 IP X.X.X.X.domain > netdisco.41046: 2338 ServFail 0/0/0 (21)
16:40:45.145408 IP netdisco.41318 > X.X.X.X.domain: 51995+ A? art. (21)
16:40:45.147942 IP X.X.X.X.domain > netdisco.41318: 51995 ServFail 0/0/0 (21)
16:40:45.151024 IP netdisco.46415 > X.X.X.X.domain: 51995+ A? art. (21)
16:40:45.153374 IP X.X.X.X.domain > netdisco.46415: 51995 ServFail 0/0/0 (21)
16:40:45.156464 IP netdisco.37226 > X.X.X.X.domain: 51995+ A? art. (21)
16:40:45.159007 IP X.X.X.X.domain > netdisco.37226: 51995 ServFail 0/0/0 (21)
16:40:47.615237 IP netdisco.36281 > X.X.X.X.domain: 2338+ A? art. (21)
16:40:47.617893 IP X.X.X.X.domain > netdisco.36281: 2338 ServFail 0/0/0 (21)
16:40:47.621474 IP netdisco.39732 > X.X.X.X.domain: 2338+ A? art. (21)
16:40:47.624758 IP X.X.X.X.domain > netdisco.39732: 2338 ServFail 0/0/0 (21)
16:40:47.627913 IP netdisco.54453 > X.X.X.X.domain: 2338+ A? art. (21)
16:40:47.630346 IP X.X.X.X.domain > netdisco.54453: 2338 ServFail 0/0/0 (21)
16:40:47.647617 IP netdisco.58391 > X.X.X.X.domain: 51995+ A? art. (21)
16:40:47.650061 IP X.X.X.X.domain > netdisco.58391: 51995 ServFail 0/0/0 (21)
16:40:47.653429 IP netdisco.55394 > X.X.X.X.domain: 51995+ A? art. (21)
16:40:47.655700 IP X.X.X.X.domain > netdisco.55394: 51995 ServFail 0/0/0 (21)
16:40:47.658896 IP netdisco.60463 > X.X.X.X.domain: 51995+ A? art. (21)
16:40:47.661307 IP X.X.X.X.domain > netdisco.60463: 51995 ServFail 0/0/0 (21)
16:40:50.117273 IP netdisco.39679 > X.X.X.X.domain: 13087+ AAAA? art. (21)
16:40:50.119735 IP X.X.X.X.domain > netdisco.39679: 13087 ServFail 0/0/0 (21)
16:40:50.122953 IP netdisco.48564 > X.X.X.X.domain: 13087+ AAAA? art. (21)
16:40:50.125281 IP X.X.X.X.domain > netdisco.48564: 13087 ServFail 0/0/0 (21)
16:40:50.128460 IP netdisco.51571 > X.X.X.X.domain: 13087+ AAAA? art. (21)
16:40:50.130982 IP X.X.X.X.domain > netdisco.51571: 13087 ServFail 0/0/0 (21)
16:40:50.150262 IP netdisco.43012 > X.X.X.X.domain: 58944+ AAAA? art. (21)
16:40:50.152625 IP X.X.X.X.domain > netdisco.43012: 58944 ServFail 0/0/0 (21)
16:40:50.155824 IP netdisco.49317 > X.X.X.X.domain: 58944+ AAAA? art. (21)
16:40:50.158116 IP X.X.X.X.domain > netdisco.49317: 58944 ServFail 0/0/0 (21)
16:40:50.161329 IP netdisco.55053 > X.X.X.X.domain: 58944+ AAAA? art. (21)
16:40:50.163698 IP X.X.X.X.domain > netdisco.55053: 58944 ServFail 0/0/0 (21)
16:40:52.619841 IP netdisco.53382 > X.X.X.X.domain: 13087+ AAAA? art. (21)
16:40:52.622489 IP X.X.X.X.domain > netdisco.53382: 13087 ServFail 0/0/0 (21)
16:40:52.625949 IP netdisco.57293 > X.X.X.X.domain: 13087+ AAAA? art. (21)
16:40:52.628365 IP X.X.X.X.domain > netdisco.57293: 13087 ServFail 0/0/0 (21)
16:40:52.631845 IP netdisco.45457 > X.X.X.X.domain: 13087+ AAAA? art. (21)
16:40:52.634188 IP X.X.X.X.domain > netdisco.45457: 13087 ServFail 0/0/0 (21)
16:40:52.652400 IP netdisco.48293 > X.X.X.X.domain: 58944+ AAAA? art. (21)
16:40:52.654990 IP X.X.X.X.domain > netdisco.48293: 58944 ServFail 0/0/0 (21)
16:40:52.658283 IP netdisco.48203 > X.X.X.X.domain: 58944+ AAAA? art. (21)
16:40:52.660639 IP X.X.X.X.domain > netdisco.48203: 58944 ServFail 0/0/0 (21)
16:40:52.664113 IP netdisco.53887 > X.X.X.X.domain: 58944+ AAAA? art. (21)
16:40:52.666605 IP X.X.X.X.domain > netdisco.53887: 58944 ServFail 0/0/0 (21)
16:40:55.122352 IP netdisco.36076 > X.X.X.X.domain: 33209+ A? art. (21)
16:40:55.125240 IP X.X.X.X.domain > netdisco.36076: 33209 ServFail 0/0/0 (21)
16:40:55.128507 IP netdisco.54451 > X.X.X.X.domain: 33209+ A? art. (21)
16:40:55.131060 IP X.X.X.X.domain > netdisco.54451: 33209 ServFail 0/0/0 (21)
16:40:55.134175 IP netdisco.58054 > X.X.X.X.domain: 33209+ A? art. (21)
16:40:55.136616 IP X.X.X.X.domain > netdisco.58054: 33209 ServFail 0/0/0 (21)
16:40:55.155476 IP netdisco.46968 > X.X.X.X.domain: 7643+ A? art. (21)
16:40:55.159172 IP X.X.X.X.domain > netdisco.46968: 7643 ServFail 0/0/0 (21)
16:40:55.162410 IP netdisco.44513 > X.X.X.X.domain: 7643+ A? art. (21)
16:40:55.165117 IP X.X.X.X.domain > netdisco.44513: 7643 ServFail 0/0/0 (21)
16:40:55.168250 IP netdisco.44670 > X.X.X.X.domain: 7643+ A? art. (21)
16:40:55.170755 IP X.X.X.X.domain > netdisco.44670: 7643 ServFail 0/0/0 (21)
16:40:57.624517 IP netdisco.54143 > X.X.X.X.domain: 33209+ A? art. (21)
16:40:57.626988 IP X.X.X.X.domain > netdisco.54143: 33209 ServFail 0/0/0 (21)
16:40:57.630180 IP netdisco.40846 > X.X.X.X.domain: 33209+ A? art. (21)
16:40:57.632550 IP X.X.X.X.domain > netdisco.40846: 33209 ServFail 0/0/0 (21)
16:40:57.635723 IP netdisco.55861 > X.X.X.X.domain: 33209+ A? art. (21)
16:40:57.637967 IP X.X.X.X.domain > netdisco.55861: 33209 ServFail 0/0/0 (21)
16:40:57.658449 IP netdisco.43831 > X.X.X.X.domain: 7643+ A? art. (21)
16:40:57.661272 IP X.X.X.X.domain > netdisco.43831: 7643 ServFail 0/0/0 (21)
16:40:57.664406 IP netdisco.60554 > X.X.X.X.domain: 7643+ A? art. (21)
16:40:57.666835 IP X.X.X.X.domain > netdisco.60554: 7643 ServFail 0/0/0 (21)
16:40:57.669878 IP netdisco.56640 > X.X.X.X.domain: 7643+ A? art. (21)
16:40:57.672411 IP X.X.X.X.domain > netdisco.56640: 7643 ServFail 0/0/0 (21)
</pre>

For test only,:-)  ....when I wirte "www.google.com.ar" in the WebSearch this is the tcpdump:
<pre>
16:41:51.281267 IP netdisco.59293 > X.X.X.X.domain: 39225+ A? www.google.com.ar. (35)
16:41:51.283938 IP X.X.X.X.domain > netdisco.59293: 39225 1/0/0 A 142.250.79.67 (51)
</pre>

Is it possible to disable this behavior in the WebSearch?

**Comment by ollyg** [comment]
Hi @Ignacet well done! It took me a while to work out where the DNS lookup is happening, it is here:
https://github.com/netdisco/netdisco/blob/master/lib/App/Netdisco/DB/ResultSet/Device.pm#L397

Anyway, I'm not sure that the best solution is to always add the suffix. There seems to be some local problem at your site if a DNS request for an unknown record results in ServFail (for example have you tried with foobar.foobar.foobar in the search?). If we just add the DNS domain it might still be an unknown record and you get the same 15 seconds.

I suggest to investigate your local DNS resolver configuration to find out why it isn't immediately returning NXDOMAIN.

**Comment by ollyg** [comment]
patched in d8a9ad90

**Comment by ollyg** [comment]
I've implemented a small patch which I think should make the experience better for those in your situation, but the build service is currently broken so I can't release it! Feel free to try it out if you can (ref d8a9ad9)

**Comment by Ignacet** [comment]
> Hi @Ignacet well done! It took me a while to work out where the DNS lookup is happening, it is here: https://github.com/netdisco/netdisco/blob/master/lib/App/Netdisco/DB/ResultSet/Device.pm#L397
> 
> Anyway, I'm not sure that the best solution is to always add the suffix. There seems to be some local problem at your site if a DNS request for an unknown record results in ServFail (for example have you tried with foobar.foobar.foobar in the search?). If we just add the DNS domain it might still be an unknown record and you get the same 15 seconds.
> 
> I suggest to investigate your local DNS resolver configuration to find out why it isn't immediately returning NXDOMAIN.

@ollyg, look this capture:
- Firt search term "art.chain.chain" and take 76mseg to finish
- Second search term "art." and take 15 Seg to finish

![image](https://user-images.githubusercontent.com/35425405/136201518-65f547ac-41f5-4cb8-abd8-2407112af939.png)

This is the TcpDump output:
first, **with the fake FQDN**, NXDomain msg
<pre>
09:21:58.438012 IP jnk-ansible.ntw.copr.ar.57472 > dctasa01.tasa.telefonica.com.ar.domain: 61759+ AAAA? art.chain.chain. (33)
09:21:58.440558 IP dctasa01.tasa.telefonica.com.ar.domain > jnk-ansible.ntw.copr.ar.57472: 61759 NXDomain 0/1/0 (108)
</pre>

Second, with no FQDN, ServFail msg
<pre>
09:22:06.684048 IP netdisco.47182 > X.X.X.X.domain: 64022+ A? art. (21)
09:22:06.686603 IP X.X.X.X.domain > netdisco.47182: 64022 ServFail 0/0/0 (21)
09:22:06.689360 IP netdisco.55273 > X.X.X.X.domain: 64022+ A? art. (21)
09:22:06.691859 IP X.X.X.X.domain > netdisco.55273: 64022 ServFail 0/0/0 (21)
09:22:06.694576 IP netdisco.53011 > X.X.X.X.domain: 64022+ A? art. (21)
09:22:06.696973 IP X.X.X.X.domain > netdisco.53011: 64022 ServFail 0/0/0 (21)
09:22:09.186319 IP netdisco.47715 > X.X.X.X.domain: 64022+ A? art. (21)
09:22:09.188941 IP X.X.X.X.domain > netdisco.47715: 64022 ServFail 0/0/0 (21)
09:22:09.191673 IP netdisco.44214 > X.X.X.X.domain: 64022+ A? art. (21)
09:22:09.194641 IP X.X.X.X.domain > netdisco.44214: 64022 ServFail 0/0/0 (21)
09:22:09.197625 IP netdisco.37410 > X.X.X.X.domain: 64022+ A? art. (21)
09:22:09.200271 IP X.X.X.X.domain > netdisco.37410: 64022 ServFail 0/0/0 (21)
09:22:11.686664 IP netdisco.47801 > X.X.X.X.domain: 19271+ AAAA? art. (21)
09:22:11.689145 IP X.X.X.X.domain > netdisco.47801: 19271 ServFail 0/0/0 (21)
09:22:11.691954 IP netdisco.45320 > X.X.X.X.domain: 19271+ AAAA? art. (21)
09:22:11.694741 IP X.X.X.X.domain > netdisco.45320: 19271 ServFail 0/0/0 (21)
09:22:11.697589 IP netdisco.37249 > X.X.X.X.domain: 19271+ AAAA? art. (21)
09:22:11.700284 IP X.X.X.X.domain > netdisco.37249: 19271 ServFail 0/0/0 (21)
09:22:14.189328 IP netdisco.39077 > X.X.X.X.domain: 19271+ AAAA? art. (21)
09:22:14.191942 IP X.X.X.X.domain > netdisco.39077: 19271 ServFail 0/0/0 (21)
09:22:14.194928 IP netdisco.58720 > X.X.X.X.domain: 19271+ AAAA? art. (21)
09:22:14.197655 IP X.X.X.X.domain > netdisco.58720: 19271 ServFail 0/0/0 (21)
09:22:14.200710 IP netdisco.48641 > X.X.X.X.domain: 19271+ AAAA? art. (21)
09:22:14.203652 IP X.X.X.X.domain > netdisco.48641: 19271 ServFail 0/0/0 (21)
09:22:16.690319 IP netdisco.43754 > X.X.X.X.domain: 49497+ A? art. (21)
09:22:16.692973 IP X.X.X.X.domain > netdisco.43754: 49497 ServFail 0/0/0 (21)
09:22:16.696039 IP netdisco.38511 > X.X.X.X.domain: 49497+ A? art. (21)
09:22:16.698681 IP X.X.X.X.domain > netdisco.38511: 49497 ServFail 0/0/0 (21)
09:22:16.702171 IP netdisco.39256 > X.X.X.X.domain: 49497+ A? art. (21)
09:22:16.704901 IP X.X.X.X.domain > netdisco.39256: 49497 ServFail 0/0/0 (21)
09:22:19.190099 IP netdisco.40800 > X.X.X.X.domain: 49497+ A? art. (21)
09:22:19.192749 IP X.X.X.X.domain > netdisco.40800: 49497 ServFail 0/0/0 (21)
09:22:19.196383 IP netdisco.33970 > X.X.X.X.domain: 49497+ A? art. (21)
09:22:19.199007 IP X.X.X.X.domain > netdisco.33970: 49497 ServFail 0/0/0 (21)
09:22:19.202199 IP netdisco.58821 > X.X.X.X.domain: 49497+ A? art. (21)
09:22:19.204835 IP X.X.X.X.domain > netdisco.58821: 49497 ServFail 0/0/0 (21)
</pre>

I think, for DNS protocol **is mandatory the FQDN in the request**, is not a misconfiguration in the DNS.

**Comment by Ignacet** [comment]
> I've implemented a small patch which I think should make the experience better for those in your situation, but the build service is currently broken so I can't release it! Feel free to try it out if you can (ref [d8a9ad9](https://github.com/netdisco/netdisco/commit/d8a9ad90076f69bac207453f7e9fe1bd06626de6))

@ollyg, I am going to test it and I will notify you of the results.
Tks...

**Comment by schmug** [comment]
@ollyg, adding in to say I manually put #d8a9ad9 into my docker deployment and I notice no change. I can get it to drop from 15s for 'search?' and 15s for 'node?'  (30s total) to 3s for 'search?' and 3s for 'node?' by editing resolv.conf

`options ndots:0 timeout:1 retries:0`

**Comment by schmug** [comment]
> by editing resolv.conf
> 
> `options ndots:0 timeout:1 retries:0`

by changing to:

`ndots:1`

I am now getting sub 1s netdisco searches for devices and nodes with DNS, 3s searches for hostnames not in DNS

**Comment by ollyg** [comment]
Thanks @schmug! Are you able to share the resolv.conf file in the container as we could make sure our own container builds of Netdisco include the correct options to reduce the impact of this.

Thanks also for testing the patch, I will look for other parts of the code where it might be doing DNS resolution, but it's tricky!

**Comment by ollyg** [comment]
Thank you @schmug and @Ignacet much appreciated, and thank you for patience and supporting Netdisco!

**Comment by Ignacet** [comment]
@ollyg, tks to you for your time 🥇.

Now I modify (d8a9ad9) in a production netdisco (1k devices and 16k nodes, and docker environment), and it's improve the Node Search and Device Search response, and obiusly Typehead process responce. 💯  ...... All this without touch the /etc/resolv.conf in the machine host or container.

**Comment by ollyg** [comment]
Closing ticket now, as we have the working patch in master branch

**Comment by Ignacet** [comment]
@ollyg , in this url, http://X.X.X.X:5000/ajax/content/search/node?tab=node&q=XXXXX&stamps=on&deviceports=on&daterange=&mac_format=IEEE, same issue 15 seconds delay.
